{
  "schema_version": "v1",
  "generated_at": "2026-03-15T00:00:00Z",
  "sources": [
    {
      "source_id": "calendar_source_ics_01",
      "label": "Synthetic commitments",
      "kind": "ics",
      "read_only": true,
      "coverage_start_at": "2025-03-14T00:00:00Z",
      "coverage_end_at": "2028-03-16T00:00:00Z",
      "last_imported_at": "2026-03-15T00:00:00Z"
    },
    {
      "source_id": "calendar_source_zeitboard",
      "label": "ZeitBoard placements",
      "kind": "zeitboard",
      "read_only": false,
      "coverage_start_at": "2025-03-14T00:00:00Z",
      "coverage_end_at": "2028-03-16T00:00:00Z",
      "last_imported_at": "2026-03-15T00:00:00Z"
    }
  ],
  "events": [
    {
      "event_id": "calendar_event_imported_01",
      "source_id": "calendar_source_ics_01",
      "source_record_id": "fixture-event-01@zeitboard.local/20260315T190000Z",
      "title": "Synthetic fixed commitment",
      "start_at": "2026-03-15T22:50:00Z",
      "end_at": "2026-03-15T23:50:00Z",
      "zone_id": "America/New_York",
      "all_day": false,
      "busy": true,
      "ownership": "imported",
      "created_at": "2026-03-15T00:00:00Z",
      "location": "Synthetic location"
    },
    {
      "event_id": "calendar_event_owned_01",
      "source_id": "calendar_source_zeitboard",
      "source_record_id": "proposal_task_01",
      "title": "Synthetic paperwork block",
      "start_at": "2026-03-15T21:20:00Z",
      "end_at": "2026-03-15T21:50:00Z",
      "zone_id": "America/New_York",
      "all_day": false,
      "busy": true,
      "ownership": "app_owned",
      "created_at": "2026-03-15T00:00:00Z",
      "task_id": "task_flexible_01",
      "task_revision": 1,
      "proposal_id": "proposal_task_01"
    }
  ]
}
